site_id;site_name;site_emoji;hero_image_url;daily_activities;tour_schedule;gallery_img_01;gallery_img_02;gallery_img_03;gallery_img_04;review_1_image;review_1_text;review_1_author;review_2_image;review_2_text;review_2_author;review_3_image;review_3_text;review_3_author;google_business_url;phone_number
isla-tortuga-costa-rica;Isla Tortuga Costa Rica;🏝️;https://lh3.googleusercontent.com/p/AF1QipNQAPWSwElfntfAu0_VPsUcA4LxauIUnwdqOqaF=s1360-w1360-h1020-rw;Snorkel in crystal-clear waters | Relax on pristine white sand beach | Enjoy a delicious lunch buffet | Kayaking and stand-up paddleboarding | Sunset views on the return journey;7:00 AM - Hotel pickup | 8:30 AM - Depart from Marina Los Sueños | 11:00 AM - Arrive at Isla Tortuga | 12:30 PM - Lunch served | 2:00 PM - Beach time and snorkeling | 3:30 PM - Depart island | 5:30 PM - Return to marina | 7:00 PM - Hotel drop-off;https://costacat.b-cdn.net/wp-content/uploads/2025/04/DSC5373-1024x683.jpg;https://costacat.b-cdn.net/wp-content/uploads/2025/06/Wahoo-1024x682.jpg;https://costacat.b-cdn.net/wp-content/uploads/2025/10/DSC3532-1024x683.jpg;https://costacat.b-cdn.net/wp-content/uploads/2025/10/DSC6659-1024x683.jpg;https://dynamic-media-cdn.tripadvisor.com/media/photo-o/32/55/63/09/caption.jpg?w=1100&h=-1&s=1;I would give 100 stars if I could. We took the private boat to the island. Everything was top notch and the crew was absolutely the best. We had a wonderful time and would def go again.;Lisa D;https://dynamic-media-cdn.tripadvisor.com/media/photo-o/32/3e/ed/4b/caption.jpg?w=1400&h=-1&s=1;Everything was well organized. The amazing crew takes excellent care of everyone non stop! Best of all were the 3 whales we saw on the way back!;ToryLyn;https://dynamic-media-cdn.tripadvisor.com/media/photo-o/32/25/e7/cb/caption.jpg?w=1400&h=-1&s=1;Journée parfaite pour se détendre sur une belle île avec Tortuga Island Catamaran Tour qui est vraiment un excellent tour opérateur.;Christina;google.com/maps/place/Tortuga+Island+Catamaran+Tour/data=!4m2!3m1!1s0x0:0xc8d8e40d6281007b?sa=X&ved=1t:2428&ictx=111;+506-8450-9498
catamaran-tour-isla-tortuga;Catamaran Tour Isla Tortuga;⛵;https://images.unsplash.com/photo-1567899378494-47b22a2ae96a;Sail on a luxurious catamaran through the Gulf of Nicoya | Swim and snorkel in tropical waters teeming with marine life | Enjoy unlimited tropical drinks and fresh fruit onboard | Feast on a gourmet beachside lunch | Explore natural pools and hidden beaches;7:30 AM - Pickup from area hotels | 9:00 AM - Set sail from Puntarenas on premium catamaran | 10:30 AM - Swimming and snorkeling stop at coral reef | 11:30 AM - Continue sailing to Isla Tortuga | 12:00 PM - Beach arrival and free time | 1:00 PM - Beach lunch service | 3:00 PM - Departure from island | 5:00 PM - Return to pier with sunset views | 6:30 PM - Hotel drop-off;https://images.unsplash.com/photo-1567899378494-47b22a2ae96a;https://images.unsplash.com/photo-1544551763-46a013bb70d5;https://images.unsplash.com/photo-1540202404-a2f29016b523;https://images.unsplash.com/photo-1473496169904-658ba7c44d8a;https://i.pravatar.cc/150?img=12;The catamaran was beautiful and spacious. Crew went above and beyond. This tour exceeded our expectations in every way!;David Martinez;https://i.pravatar.cc/150?img=8;Best investment of our vacation! The snorkeling gear was top quality and we saw so many fish. Beach was pristine and uncrowded.;Jennifer Lee;https://i.pravatar.cc/150?img=15;Amazing service from start to finish. Transportation was punctual, crew was friendly, and the whole experience was seamless.;Robert Thompson;https://g.page/catamaran-tortuga;+506-8450-9498
private-charter-isla-tortuga;Private Charter Isla Tortuga;🛥️;https://images.unsplash.com/photo-1544551763-46a013bb70d5;Exclusive private catamaran experience for your group only | Customizable itinerary based on your preferences | Premium open bar with cocktails and champagne | Personalized gourmet meal prepared by private chef | Water sports equipment: kayaks, paddleboards, snorkeling gear;8:00 AM - Private hotel pickup in luxury vehicle | 9:30 AM - Board your exclusive chartered catamaran | 10:00 AM - Depart at your preferred time | 11:00 AM - Snorkeling at secluded spots (customizable) | 12:00 PM - Arrive at private beach area | 1:00 PM - Gourmet lunch service on beach or boat | 3:00 PM - Additional activities or early departure (flexible) | 5:00 PM - Return sailing with premium cocktails | 7:00 PM - Private transfer back to hotel;https://images.unsplash.com/photo-1544551763-46a013bb70d5;https://images.unsplash.com/photo-1567899378494-47b22a2ae96a;https://images.unsplash.com/photo-1520443240718-fce21cc0cb0b;https://images.unsplash.com/photo-1473496169904-658ba7c44d8a;https://i.pravatar.cc/150?img=20;We chartered for our anniversary and it was magical. Complete privacy, incredible service, and the crew made us feel like royalty.;Amanda Williams;https://i.pravatar.cc/150?img=18;Corporate event on the catamaran was a huge success. Professional crew, beautiful boat, and our clients were thoroughly impressed.;James Peterson;https://i.pravatar.cc/150?img=22;Worth every dollar for a private experience. Being able to customize our schedule and activities made this the highlight of our honeymoon.;Sophie Anderson;https://g.page/costa-cat-cruises;+506-8450-9498
fishing-jaco-costa-rica;Sport Fishing Jaco Costa Rica;🎣;https://images.unsplash.com/photo-1544943910-4c1dc44aab44;Deep sea fishing for marlin, sailfish, and dorado | Professional captain and first mate with local expertise | Top-quality fishing gear and tackle provided | Catch cleaning and preparation included | Coolers with ice, drinks, and snacks onboard;5:30 AM - Marina pickup or hotel transfer | 6:00 AM - Safety briefing and departure from Los Sueños Marina | 6:30 AM - Reach prime fishing grounds offshore | 6:45 AM - Begin trolling for big game fish | 12:00 PM - Lunch break (fishing continues inshore) | 2:00 PM - Return to marina with your catch | 2:30 PM - Fish cleaning and photo session | 3:00 PM - Transfer back to hotel;https://images.unsplash.com/photo-1544943910-4c1dc44aab44;https://images.unsplash.com/photo-1559675553-f369aea7e83b;https://images.unsplash.com/photo-1535591273668-578e31182c4f;https://images.unsplash.com/photo-1534043464124-3be32fe000c9;https://i.pravatar.cc/150?img=25;Caught a 200lb sailfish! Captain knew exactly where to go. This fishing charter was world-class. Can't wait to come back next year.;Tom Anderson;https://i.pravatar.cc/150?img=28;Best fishing trip of my life. Crew was knowledgeable, boat was well-maintained, and we caught multiple dorado. Highly professional operation.;Chris Walker;https://i.pravatar.cc/150?img=30;Even though I'm a beginner, the crew made me feel confident. We caught several fish and they taught me so much. Unforgettable experience!;Maria Garcia;https://g.page/fishing-jaco-cr;+506-8450-9498
catamaran-sunset;Catamaran Sunset Cruise;🌅;https://images.unsplash.com/photo-1506905925346-21bda4d32df4;Romantic sunset sailing along Costa Rica's coast | Unlimited premium cocktails, wine, and appetizers | Live music or DJ on select nights | Watch dolphins and sea turtles in their natural habitat | Perfect for couples, celebrations, or special occasions;4:00 PM - Hotel pickup from Central Pacific area | 5:00 PM - Board luxury sunset catamaran | 5:30 PM - Set sail along the coastline | 6:00 PM - Appetizers and cocktails served | 6:30 PM - Witness spectacular Pacific sunset | 7:15 PM - Continue evening cruise under stars | 8:00 PM - Return to marina | 8:30 PM - Hotel drop-off;https://images.unsplash.com/photo-1506905925346-21bda4d32df4;https://images.unsplash.com/photo-1495954484750-af469f2f9be5;https://images.unsplash.com/photo-1518709268805-4e9042af9f23;https://images.unsplash.com/photo-1473496169904-658ba7c44d8a;https://i.pravatar.cc/150?img=35;Most romantic evening ever! Proposed to my girlfriend during the sunset and the crew helped make it perfect. Champagne, music, pure magic.;Alex Rivera;https://i.pravatar.cc/150?img=32;Beautiful cruise with amazing views. Drinks were excellent and unlimited. Saw dolphins swimming alongside the boat. Absolutely wonderful!;Lisa Hamilton;https://i.pravatar.cc/150?img=38;Perfect way to end our Costa Rica trip. The sunset was breathtaking, crew was attentive, and the whole vibe was incredibly relaxing.;Kevin Brown;https://g.page/catamaran-sunset-cr;+506-8450-9498
isla-tortuga-2-costa-rica;Isla Tortuga 2 Costa Rica;⛵;https://lh3.googleusercontent.com/p/AF1QipNQAPWSwElfntfAu0_VPsUcA4LxauIUnwdqOqaF=s1360-w1360-h1020-rw;Snorkel in crystal-clear waters | Relax on pristine white sand beach | Enjoy a delicious lunch buffet | Kayaking and stand-up paddleboarding | Sunset views on the return journey;7:00 AM - Hotel pickup | 8:30 AM - Depart from Marina Los Sueños | 11:00 AM - Arrive at Isla Tortuga | 12:30 PM - Lunch served | 2:00 PM - Beach time and snorkeling | 3:30 PM - Depart island | 5:30 PM - Return to marina | 7:00 PM - Hotel drop-off;https://costacat.b-cdn.net/wp-content/uploads/2025/04/DSC5373-1024x683.jpg;https://costacat.b-cdn.net/wp-content/uploads/2025/06/Wahoo-1024x682.jpg;https://costacat.b-cdn.net/wp-content/uploads/2025/10/DSC3532-1024x683.jpg;https://costacat.b-cdn.net/wp-content/uploads/2025/10/DSC6659-1024x683.jpg;https://dynamic-media-cdn.tripadvisor.com/media/photo-o/32/55/63/09/caption.jpg?w=1100&h=-1&s=1;I would give 100 stars if I could. We took the private boat to the island. Everything was top notch and the crew was absolutely the best. We had a wonderful time and would def go again.;Lisa D;https://dynamic-media-cdn.tripadvisor.com/media/photo-o/32/3e/ed/4b/caption.jpg?w=1400&h=-1&s=1;Everything was well organized. The amazing crew takes excellent care of everyone non stop! Best of all were the 3 whales we saw on the way back!;ToryLyn;https://dynamic-media-cdn.tripadvisor.com/media/photo-o/32/25/e7/cb/caption.jpg?w=1400&h=-1&s=1;Journée parfaite pour se détendre sur une belle île avec Tortuga Island Catamaran Tour qui est vraiment un excellent tour opérateur.;Christina;google.com/maps/place/Tortuga+Island+Catamaran+Tour/data=!4m2!3m1!1s0x0:0xc8d8e40d6281007b?sa=X&ved=1t:2428&ictx=111;+506-8450-9498
isla-tortuga-3-costa-rica;Isla Tortuga 3 Costa Rica;⛵;https://lh3.googleusercontent.com/p/AF1QipNQAPWSwElfntfAu0_VPsUcA4LxauIUnwdqOqaF=s1360-w1360-h1020-rw;Snorkel in crystal-clear waters | Relax on pristine white sand beach | Enjoy a delicious lunch buffet | Kayaking and stand-up paddleboarding | Sunset views on the return journey;7:00 AM - Hotel pickup | 8:30 AM - Depart from Marina Los Sueños | 11:00 AM - Arrive at Isla Tortuga | 12:30 PM - Lunch served | 2:00 PM - Beach time and snorkeling | 3:30 PM - Depart island | 5:30 PM - Return to marina | 7:00 PM - Hotel drop-off;https://costacat.b-cdn.net/wp-content/uploads/2025/04/DSC5373-1024x683.jpg;https://costacat.b-cdn.net/wp-content/uploads/2025/06/Wahoo-1024x682.jpg;https://costacat.b-cdn.net/wp-content/uploads/2025/10/DSC3532-1024x683.jpg;https://costacat.b-cdn.net/wp-content/uploads/2025/10/DSC6659-1024x683.jpg;https://dynamic-media-cdn.tripadvisor.com/media/photo-o/32/55/63/09/caption.jpg?w=1100&h=-1&s=1;I would give 100 stars if I could. We took the private boat to the island. Everything was top notch and the crew was absolutely the best. We had a wonderful time and would def go again.;Lisa D;https://dynamic-media-cdn.tripadvisor.com/media/photo-o/32/3e/ed/4b/caption.jpg?w=1400&h=-1&s=1;Everything was well organized. The amazing crew takes excellent care of everyone non stop! Best of all were the 3 whales we saw on the way back!;ToryLyn;https://dynamic-media-cdn.tripadvisor.com/media/photo-o/32/25/e7/cb/caption.jpg?w=1400&h=-1&s=1;Journée parfaite pour se détendre sur une belle île avec Tortuga Island Catamaran Tour qui est vraiment un excellent tour opérateur.;Christina;google.com/maps/place/Tortuga+Island+Catamaran+Tour/data=!4m2!3m1!1s0x0:0xc8d8e40d6281007b?sa=X&ved=1t:2428&ictx=111;+506-8450-9498
isla-tortuga-4-costa-rica;Isla Tortuga 4 Costa Rica;⛵;https://lh3.googleusercontent.com/p/AF1QipNQAPWSwElfntfAu0_VPsUcA4LxauIUnwdqOqaF=s1360-w1360-h1020-rw;Snorkel in crystal-clear waters | Relax on pristine white sand beach | Enjoy a delicious lunch buffet | Kayaking and stand-up paddleboarding | Sunset views on the return journey;7:00 AM - Hotel pickup | 8:30 AM - Depart from Marina Los Sueños | 11:00 AM - Arrive at Isla Tortuga | 12:30 PM - Lunch served | 2:00 PM - Beach time and snorkeling | 3:30 PM - Depart island | 5:30 PM - Return to marina | 7:00 PM - Hotel drop-off;https://costacat.b-cdn.net/wp-content/uploads/2025/04/DSC5373-1024x683.jpg;https://costacat.b-cdn.net/wp-content/uploads/2025/06/Wahoo-1024x682.jpg;https://costacat.b-cdn.net/wp-content/uploads/2025/10/DSC3532-1024x683.jpg;https://costacat.b-cdn.net/wp-content/uploads/2025/10/DSC6659-1024x683.jpg;https://dynamic-media-cdn.tripadvisor.com/media/photo-o/32/55/63/09/caption.jpg?w=1100&h=-1&s=1;I would give 100 stars if I could. We took the private boat to the island. Everything was top notch and the crew was absolutely the best. We had a wonderful time and would def go again.;Lisa D;https://dynamic-media-cdn.tripadvisor.com/media/photo-o/32/3e/ed/4b/caption.jpg?w=1400&h=-1&s=1;Everything was well organized. The amazing crew takes excellent care of everyone non stop! Best of all were the 3 whales we saw on the way back!;ToryLyn;https://dynamic-media-cdn.tripadvisor.com/media/photo-o/32/25/e7/cb/caption.jpg?w=1400&h=-1&s=1;Journée parfaite pour se détendre sur une belle île avec Tortuga Island Catamaran Tour qui est vraiment un excellent tour opérateur.;Christina;google.com/maps/place/Tortuga+Island+Catamaran+Tour/data=!4m2!3m1!1s0x0:0xc8d8e40d6281007b?sa=X&ved=1t:2428&ictx=111;+506-8450-9498